id,name,parent_id,description,active
9f3165ac-ccba-4c6b-aab2-50dbe28d7f11,Lessons Learned,3434d021-38f4-4ef0-bb94-1becd677c025,Subcategory for Lessons Learned,True
4b5acc1e-e87d-491e-9207-68a555ae9e75,Project Documentation,3434d021-38f4-4ef0-bb94-1becd677c025,Subcategory for Project Documentation,True
7dde6980-62f5-482d-b5ea-f27ced077826,Process Review Request,70d57f4b-449b-4c5f-830c-010a9428100a,Subcategory for Process Review Request,True
ff5beeba-99c5-4224-9605-6d9e805e4d0f,Automation Request,70d57f4b-449b-4c5f-830c-010a9428100a,Subcategory for Automation Request,True
f42e2729-5449-49ee-a57e-0f029fe0b4f9,Template Request,70d57f4b-449b-4c5f-830c-010a9428100a,Subcategory for Template Request,True
1e138a27-8a46-4aca-b382-c5a17485c940,Training Material,70d57f4b-449b-4c5f-830c-010a9428100a,Subcategory for Training Material,True
b109e336-818b-4210-ae61-bcf280afb8d8,Documentation Update,70d57f4b-449b-4c5f-830c-010a9428100a,Subcategory for Documentation Update,True
72c94780-2bff-4a46-82f2-5ba2601af4e1,SOP Creation,70d57f4b-449b-4c5f-830c-010a9428100a,Subcategory for SOP Creation,True
306b066b-b949-4d3f-ae4b-5672989a2a42,Workflow Optimization,70d57f4b-449b-4c5f-830c-010a9428100a,Subcategory for Workflow Optimization,True
18a0ff4f-fad6-471e-90f4-e4bc4e479f99,Tool Evaluation,70d57f4b-449b-4c5f-830c-010a9428100a,Subcategory for Tool Evaluation,True
