id,name,parent_id,description,active
e2233e75-04b1-43d7-a1de-9409edcc9c14,Brand Strategy & Guidelines,b52fbfe5-e1a8-4b3e-9889-0347f7430f0d,Subcategory for Brand Strategy & Guidelines,True
75b27f1a-9116-474e-9478-7b0f8256c3eb,Campaign Planning,b52fbfe5-e1a8-4b3e-9889-0347f7430f0d,Subcategory for Campaign Planning,True
33bac09a-e2f3-40f7-a228-05ecb62d842a,Creative Brief Development,b52fbfe5-e1a8-4b3e-9889-0347f7430f0d,Subcategory for Creative Brief Development,True
1da4b66a-1379-48c2-bb6e-7a0240cbc1a6,Brand Asset Request,b52fbfe5-e1a8-4b3e-9889-0347f7430f0d,Subcategory for Brand Asset Request,True
ceda5dce-6135-45a9-a880-63252de49029,Marketing Collateral,b52fbfe5-e1a8-4b3e-9889-0347f7430f0d,Subcategory for Marketing Collateral,True
04c07d1a-2c0e-4070-b9e1-d72d8bd57535,Print Materials,b52fbfe5-e1a8-4b3e-9889-0347f7430f0d,Subcategory for Print Materials,True
6c1dd44c-4d25-4f82-bcb5-691246aea44c,Promotional Items,b52fbfe5-e1a8-4b3e-9889-0347f7430f0d,Subcategory for Promotional Items,True
543fd864-de52-420c-9bac-7542b1f8ae7f,Signage Request,b52fbfe5-e1a8-4b3e-9889-0347f7430f0d,Subcategory for Signage Request,True
1e4b4761-b917-472c-92ff-85b3f7a798ae,Logo Usage Request,b52fbfe5-e1a8-4b3e-9889-0347f7430f0d,Subcategory for Logo Usage Request,True
a953efc6-0bf4-4c12-8e3e-7780dbffee2c,Brand Approval,b52fbfe5-e1a8-4b3e-9889-0347f7430f0d,Subcategory for Brand Approval,True
f9c490c8-e0d0-4c0a-930f-1734958bb9ab,Social Media Graphics,34f20a3c-1196-423a-a771-3a8e3f8ed39f,Subcategory for Social Media Graphics,True
b01cff0b-326c-4b29-84e7-3ad832094316,Email Graphics,34f20a3c-1196-423a-a771-3a8e3f8ed39f,Subcategory for Email Graphics,True
be8687b9-6706-4285-8123-9d225f7529e1,Presentation Design,34f20a3c-1196-423a-a771-3a8e3f8ed39f,Subcategory for Presentation Design,True
cd5ee6d9-773a-49e4-b5c1-8856780e5a64,Infographic Design,34f20a3c-1196-423a-a771-3a8e3f8ed39f,Subcategory for Infographic Design,True
f6566a19-9490-4e50-9dbe-709631663f92,Banner Design,34f20a3c-1196-423a-a771-3a8e3f8ed39f,Subcategory for Banner Design,True
d94d56e5-347f-4fd1-bd36-f038b9f480b1,Flyer Design,34f20a3c-1196-423a-a771-3a8e3f8ed39f,Subcategory for Flyer Design,True
4f7c3fa5-ee52-4756-bc37-4e01a68fa5ad,Brochure Design,34f20a3c-1196-423a-a771-3a8e3f8ed39f,Subcategory for Brochure Design,True
ee8fc76c-c694-4423-b8da-da704aceaf51,Business Card Design,34f20a3c-1196-423a-a771-3a8e3f8ed39f,Subcategory for Business Card Design,True
3b88a986-7e5f-4e2b-8b90-f4ce6b91b475,Postcard Design,34f20a3c-1196-423a-a771-3a8e3f8ed39f,Subcategory for Postcard Design,True
09cb2b12-7e35-4168-a43f-a8ba72130e0d,Ad Creative Design,34f20a3c-1196-423a-a771-3a8e3f8ed39f,Subcategory for Ad Creative Design,True
5902fd76-f798-4af3-af3c-89902f9950bc,Illustration Request,34f20a3c-1196-423a-a771-3a8e3f8ed39f,Subcategory for Illustration Request,True
f67376d2-51ec-47d8-b945-62337e2b2410,Icon Design,34f20a3c-1196-423a-a771-3a8e3f8ed39f,Subcategory for Icon Design,True
8221aaed-10d7-47e6-bee0-5051ca4bc6c1,Blog Post Writing,b3f74826-1410-4272-a20d-a190844a5898,Subcategory for Blog Post Writing,True
47a78e0b-c26b-44d4-b17b-4f2b79d34440,Article Writing,b3f74826-1410-4272-a20d-a190844a5898,Subcategory for Article Writing,True
af1dbf76-91e0-447b-8927-1f00bb7db095,Press Release,b3f74826-1410-4272-a20d-a190844a5898,Subcategory for Press Release,True
f203e153-652b-4d9c-af01-dcab4ef3231a,Email Copy,b3f74826-1410-4272-a20d-a190844a5898,Subcategory for Email Copy,True
aebc5da7-cc05-46a8-8f93-976d2edb2f4a,Landing Page Copy,b3f74826-1410-4272-a20d-a190844a5898,Subcategory for Landing Page Copy,True
98ac70b0-3eb5-48a4-a25c-ecd72f0d4273,Ad Copy,b3f74826-1410-4272-a20d-a190844a5898,Subcategory for Ad Copy,True
8c4155dd-6ce6-49fc-9920-13749e13e269,Social Media Copy,b3f74826-1410-4272-a20d-a190844a5898,Subcategory for Social Media Copy,True
d13f6a11-6f24-4a77-90ee-e5d29d62271d,Product Description,b3f74826-1410-4272-a20d-a190844a5898,Subcategory for Product Description,True
5a602dee-2138-4773-aa26-f6b03fe10c34,Website Copy,b3f74826-1410-4272-a20d-a190844a5898,Subcategory for Website Copy,True
687d3061-2f3b-464d-87f9-068bda1e26bf,Script Writing,b3f74826-1410-4272-a20d-a190844a5898,Subcategory for Script Writing,True
385904a3-5caf-4c40-9960-4991437b5cf5,Newsletter Content,b3f74826-1410-4272-a20d-a190844a5898,Subcategory for Newsletter Content,True
b58912a1-ffd6-4d94-9c1a-41d6d59e27b9,Case Study Writing,b3f74826-1410-4272-a20d-a190844a5898,Subcategory for Case Study Writing,True
2aff9568-b2d3-482d-9b95-89864efa2fee,SEO Strategy,db8fd7eb-fe9c-4514-9d3a-cd2059512ea2,Subcategory for SEO Strategy,True
1cf740a9-990a-42ad-b7e9-aab6dd468e57,SEO Audit Request,db8fd7eb-fe9c-4514-9d3a-cd2059512ea2,Subcategory for SEO Audit Request,True
ab438ff8-9530-4ff8-b08e-f05848a96dcd,Keyword Research,db8fd7eb-fe9c-4514-9d3a-cd2059512ea2,Subcategory for Keyword Research,True
31243ad3-044a-4449-97f9-6557e1868a89,Link Building Request,db8fd7eb-fe9c-4514-9d3a-cd2059512ea2,Subcategory for Link Building Request,True
ed04d3ec-e143-4373-b85b-0aa32cb27b04,Local SEO Setup,db8fd7eb-fe9c-4514-9d3a-cd2059512ea2,Subcategory for Local SEO Setup,True
4679a5ce-ad58-46f9-ad1c-d1afa6e9a2e9,Google Business Profile,db8fd7eb-fe9c-4514-9d3a-cd2059512ea2,Subcategory for Google Business Profile,True
868bf16e-a851-4b5a-9fe0-5753155c2968,PPC Campaign Setup,db8fd7eb-fe9c-4514-9d3a-cd2059512ea2,Subcategory for PPC Campaign Setup,True
049e39bc-3e32-4668-b070-aa40f9a9af5c,PPC Optimization,db8fd7eb-fe9c-4514-9d3a-cd2059512ea2,Subcategory for PPC Optimization,True
8cfdf948-b3cc-4f1f-9ef5-2eee238f922c,Display Advertising,db8fd7eb-fe9c-4514-9d3a-cd2059512ea2,Subcategory for Display Advertising,True
23f4b28d-e0fd-4882-8e79-d079026e6812,Retargeting Campaign,db8fd7eb-fe9c-4514-9d3a-cd2059512ea2,Subcategory for Retargeting Campaign,True
b0a986e0-78b1-4c35-a043-5a15c58fdcfb,Analytics Setup,db8fd7eb-fe9c-4514-9d3a-cd2059512ea2,Subcategory for Analytics Setup,True
f6b0a4b6-c7df-4196-b868-b8d41c461509,Conversion Tracking,db8fd7eb-fe9c-4514-9d3a-cd2059512ea2,Subcategory for Conversion Tracking,True
61870f16-c2d9-42e1-becb-42c3b9cad031,Social Strategy Development,1e502dc3-4fc4-41bd-8c87-10b3509300da,Subcategory for Social Strategy Development,True
1c21882f-b7c5-4fab-9cea-2b3a86c06209,Content Calendar,1e502dc3-4fc4-41bd-8c87-10b3509300da,Subcategory for Content Calendar,True
0a8714a1-cda2-4614-b686-481a04641640,Post Scheduling,1e502dc3-4fc4-41bd-8c87-10b3509300da,Subcategory for Post Scheduling,True
b7459034-437e-4f7e-ac38-cb69de21794f,Community Management,1e502dc3-4fc4-41bd-8c87-10b3509300da,Subcategory for Community Management,True
0c7802a9-bd7c-4f5b-85e8-7158f9e7c5f3,Influencer Outreach,1e502dc3-4fc4-41bd-8c87-10b3509300da,Subcategory for Influencer Outreach,True
41b1832d-e2e7-495d-950e-44c83dcc8590,Social Ad Campaign,1e502dc3-4fc4-41bd-8c87-10b3509300da,Subcategory for Social Ad Campaign,True
43b13f24-7678-4276-808f-6ac44388c3ed,Platform Setup,1e502dc3-4fc4-41bd-8c87-10b3509300da,Subcategory for Platform Setup,True
ef0f8a65-c1ba-4ad1-a532-665fe93f16e6,Social Listening,1e502dc3-4fc4-41bd-8c87-10b3509300da,Subcategory for Social Listening,True
4c9a5cb5-b8f2-4086-8e36-c4ec1a0d5a9a,Engagement Report,1e502dc3-4fc4-41bd-8c87-10b3509300da,Subcategory for Engagement Report,True
a0c9250c-6b50-4b59-947e-894608061972,Crisis Response,1e502dc3-4fc4-41bd-8c87-10b3509300da,Subcategory for Crisis Response,True
12817ab9-e8e0-4d7a-8e8d-17c4d53eba35,Email Campaign Setup,6ab047e7-3e0e-478e-8e86-2c33971d37b1,Subcategory for Email Campaign Setup,True
9ecb431f-307d-48c1-9225-cd1a38037a0c,Email Template Design,6ab047e7-3e0e-478e-8e86-2c33971d37b1,Subcategory for Email Template Design,True
6017372e-d98b-4741-9181-72d70419d3ff,Newsletter Setup,6ab047e7-3e0e-478e-8e86-2c33971d37b1,Subcategory for Newsletter Setup,True
56bd6d43-d695-4e1c-9ead-bca89c71e5a9,Drip Campaign Creation,6ab047e7-3e0e-478e-8e86-2c33971d37b1,Subcategory for Drip Campaign Creation,True
63470d55-2c9a-47a6-9cf9-ae342ba4660b,Email List Management,6ab047e7-3e0e-478e-8e86-2c33971d37b1,Subcategory for Email List Management,True
2504adcc-a118-4c82-8faf-54e17a76fc6e,A/B Testing Setup,6ab047e7-3e0e-478e-8e86-2c33971d37b1,Subcategory for A/B Testing Setup,True
ae70779b-0846-4ea1-a029-41e758fccefc,Email Automation,6ab047e7-3e0e-478e-8e86-2c33971d37b1,Subcategory for Email Automation,True
f3dccabf-6994-44e8-89ab-116eb71fcadd,Deliverability Issue,6ab047e7-3e0e-478e-8e86-2c33971d37b1,Subcategory for Deliverability Issue,True
c3e920f0-e277-42cf-bc6c-ec828ba06afc,Unsubscribe Request,6ab047e7-3e0e-478e-8e86-2c33971d37b1,Subcategory for Unsubscribe Request,True
f8ca0bca-b69a-4284-905d-4cf5082b1580,Email Analytics,6ab047e7-3e0e-478e-8e86-2c33971d37b1,Subcategory for Email Analytics,True
2796538d-960e-40d6-88d2-470b708cee3f,Video Shoot Request,34a9ef7e-37a1-4408-8165-47e764d4cfa1,Subcategory for Video Shoot Request,True
b84f94a3-4dd5-4974-be18-c4c3a3617df3,Video Editing,34a9ef7e-37a1-4408-8165-47e764d4cfa1,Subcategory for Video Editing,True
cf0a1920-6683-4a55-a6df-54013519bfb9,Motion Graphics,34a9ef7e-37a1-4408-8165-47e764d4cfa1,Subcategory for Motion Graphics,True
d43f6f70-2caa-4c37-9969-636ca1a778bb,Animation Request,34a9ef7e-37a1-4408-8165-47e764d4cfa1,Subcategory for Animation Request,True
3daa349d-ff45-49a4-8423-33a74211bd2c,Color Correction,34a9ef7e-37a1-4408-8165-47e764d4cfa1,Subcategory for Color Correction,True
245e903a-5d78-4804-b730-4e55d3d6ea0d,Audio Mixing,34a9ef7e-37a1-4408-8165-47e764d4cfa1,Subcategory for Audio Mixing,True
11a13b41-9225-4aa3-baa5-ee94ecdf4e2d,Subtitles/Captions,34a9ef7e-37a1-4408-8165-47e764d4cfa1,Subcategory for Subtitles/Captions,True
996e545d-00a4-4689-ad42-c99a353b241a,Video Thumbnail,34a9ef7e-37a1-4408-8165-47e764d4cfa1,Subcategory for Video Thumbnail,True
9a352f45-a191-434f-9f2b-118689ef4343,YouTube Optimization,34a9ef7e-37a1-4408-8165-47e764d4cfa1,Subcategory for YouTube Optimization,True
576ab220-0c17-4fae-bf57-d92dff9a60e5,Video Compression,34a9ef7e-37a1-4408-8165-47e764d4cfa1,Subcategory for Video Compression,True
fed96508-cf26-41ee-a0bf-525f8ec26ff3,Format Conversion,34a9ef7e-37a1-4408-8165-47e764d4cfa1,Subcategory for Format Conversion,True
d9f95bb6-9988-4c36-81a1-0916fc4b426c,Video Revision,34a9ef7e-37a1-4408-8165-47e764d4cfa1,Subcategory for Video Revision,True
7bb05fd6-f7dd-428e-8e3a-8576da5521f6,B-Roll Request,34a9ef7e-37a1-4408-8165-47e764d4cfa1,Subcategory for B-Roll Request,True
6c889e81-0d98-4e21-b73b-1369530b6d3c,Photo Shoot Request,2e3a9b29-39ec-4cca-9d25-603c376aa3f3,Subcategory for Photo Shoot Request,True
1cf8b323-ca1e-46d8-98a4-601cae5bbc09,Product Photography,2e3a9b29-39ec-4cca-9d25-603c376aa3f3,Subcategory for Product Photography,True
a5973cd5-b7f7-4de0-abe4-ac08540602e2,Headshot Session,2e3a9b29-39ec-4cca-9d25-603c376aa3f3,Subcategory for Headshot Session,True
5ffa1e10-b7a5-4ae9-8466-4aca79e1a02f,Event Photography,2e3a9b29-39ec-4cca-9d25-603c376aa3f3,Subcategory for Event Photography,True
f6714b01-d382-40f7-bc70-561d437a0e10,Photo Editing,2e3a9b29-39ec-4cca-9d25-603c376aa3f3,Subcategory for Photo Editing,True
e0064403-028f-4760-8d7d-a36673b86974,Photo Retouching,2e3a9b29-39ec-4cca-9d25-603c376aa3f3,Subcategory for Photo Retouching,True
143b00b9-d851-44c2-8f93-8f3d07254117,Image Cropping/Resizing,2e3a9b29-39ec-4cca-9d25-603c376aa3f3,Subcategory for Image Cropping/Resizing,True
1f3875bd-d648-4051-9acc-fa0d1e6f4f9a,Stock Photo Request,2e3a9b29-39ec-4cca-9d25-603c376aa3f3,Subcategory for Stock Photo Request,True
bdb1f48d-8641-4bf0-b628-5108c0ee276a,Photo Selection,2e3a9b29-39ec-4cca-9d25-603c376aa3f3,Subcategory for Photo Selection,True
c72473bd-f701-45b1-8b45-3432d47db8bd,Photo Archive Access,2e3a9b29-39ec-4cca-9d25-603c376aa3f3,Subcategory for Photo Archive Access,True
32b53d0a-b07d-4192-b753-3d4a8bc827d4,Podcast Recording,6e263e20-5b89-4c83-9528-17343766d515,Subcategory for Podcast Recording,True
4fd4d599-1087-4edd-b8f6-b3a0ee8c481b,Audio Editing,6e263e20-5b89-4c83-9528-17343766d515,Subcategory for Audio Editing,True
3ea3fc5a-dbef-4bfc-9c7f-564324de090f,Voiceover Recording,6e263e20-5b89-4c83-9528-17343766d515,Subcategory for Voiceover Recording,True
257f10f8-8f10-4406-8f17-d84a2ee324b0,Sound Design,6e263e20-5b89-4c83-9528-17343766d515,Subcategory for Sound Design,True
af03e862-ac6b-4f53-899d-221c5d49308f,Music Licensing,6e263e20-5b89-4c83-9528-17343766d515,Subcategory for Music Licensing,True
2af38c2b-13bb-434d-bb6e-58153e82e958,Audio Transcription,6e263e20-5b89-4c83-9528-17343766d515,Subcategory for Audio Transcription,True
3ed3faa0-468c-4fb9-9217-205f53020188,Podcast Distribution,6e263e20-5b89-4c83-9528-17343766d515,Subcategory for Podcast Distribution,True
e70f6867-af0e-4f50-b7a3-fa32424be250,Audio Format Conversion,6e263e20-5b89-4c83-9528-17343766d515,Subcategory for Audio Format Conversion,True
ee1aba42-5e6c-44b2-bb17-250a193aeafa,New Listing Setup,5820a855-88f6-4146-8372-03e267a53142,Subcategory for New Listing Setup,True
6b028a85-d0b8-4db1-ac95-66551f430bf1,Listing Photos Request,5820a855-88f6-4146-8372-03e267a53142,Subcategory for Listing Photos Request,True
69cddc8f-322c-4193-b6c9-846244389e4e,Listing Video Request,5820a855-88f6-4146-8372-03e267a53142,Subcategory for Listing Video Request,True
31e14a25-87ea-40c1-b12c-c515a641d40a,Virtual Tour Setup,5820a855-88f6-4146-8372-03e267a53142,Subcategory for Virtual Tour Setup,True
53fbaacf-07eb-4542-87de-98f83193ccab,3D Tour/Matterport,5820a855-88f6-4146-8372-03e267a53142,Subcategory for 3D Tour/Matterport,True
65e63c42-beff-454e-a550-f219799ffcbf,Listing Description,5820a855-88f6-4146-8372-03e267a53142,Subcategory for Listing Description,True
68269fa5-6a64-4cf9-9d55-057d152f1023,MLS Upload,5820a855-88f6-4146-8372-03e267a53142,Subcategory for MLS Upload,True
680bee89-dc9a-4faf-902d-3a6f15c349f1,Listing Update,5820a855-88f6-4146-8372-03e267a53142,Subcategory for Listing Update,True
5c67a9bd-7cb4-49e8-bce2-c4841e27b548,Price Change Request,5820a855-88f6-4146-8372-03e267a53142,Subcategory for Price Change Request,True
33bd65cc-171b-4ef3-8c31-0d2c291064f0,Listing Status Change,5820a855-88f6-4146-8372-03e267a53142,Subcategory for Listing Status Change,True
7e0b4621-f476-44a5-bdd6-e106cd9f51af,Coming Soon Setup,5820a855-88f6-4146-8372-03e267a53142,Subcategory for Coming Soon Setup,True
91745aac-bc75-4f3a-b0b5-6d0c9e39b008,Pocket Listing Setup,5820a855-88f6-4146-8372-03e267a53142,Subcategory for Pocket Listing Setup,True
64bcc5a0-94de-4572-96f1-8faaa97c7a85,Showing Request,09f3a427-17f0-4462-b6b7-ad42c083467b,Subcategory for Showing Request,True
f7f3b8bd-60fb-49b7-b407-a2c5e75bef31,Open House Setup,09f3a427-17f0-4462-b6b7-ad42c083467b,Subcategory for Open House Setup,True
09410d68-e7da-4939-b9d5-25b6958202ac,Open House Materials,09f3a427-17f0-4462-b6b7-ad42c083467b,Subcategory for Open House Materials,True
63d0d556-3c4e-471d-a39e-dc4b7baf2f22,Buyer Presentation,09f3a427-17f0-4462-b6b7-ad42c083467b,Subcategory for Buyer Presentation,True
a60b2206-2af6-4e09-9579-317ba5cd0114,Seller Presentation,09f3a427-17f0-4462-b6b7-ad42c083467b,Subcategory for Seller Presentation,True
a2277c77-8dfd-4072-9026-28f5093273f2,CMA Request,09f3a427-17f0-4462-b6b7-ad42c083467b,Subcategory for CMA Request,True
71f1a535-f454-48d5-a5b0-19e1cc77742e,Market Analysis,09f3a427-17f0-4462-b6b7-ad42c083467b,Subcategory for Market Analysis,True
8f6ccb01-6076-4239-97a5-dda16a53f1a3,Offer Preparation,09f3a427-17f0-4462-b6b7-ad42c083467b,Subcategory for Offer Preparation,True
bff3d150-5af9-465d-b45d-eee2ea8d341b,Counter Offer Support,09f3a427-17f0-4462-b6b7-ad42c083467b,Subcategory for Counter Offer Support,True
cb22b579-e039-4583-9b9f-d7c24109d2b3,Contract Review Support,09f3a427-17f0-4462-b6b7-ad42c083467b,Subcategory for Contract Review Support,True
d43bfb3b-df57-422e-9866-46a9e8594441,Closing Coordination,09f3a427-17f0-4462-b6b7-ad42c083467b,Subcategory for Closing Coordination,True
c22c0467-2d3f-4a5b-8177-177a2c1024bc,Post-Sale Follow-up,09f3a427-17f0-4462-b6b7-ad42c083467b,Subcategory for Post-Sale Follow-up,True
8793171b-bfb2-4c53-9ccf-108c7af39abe,Staging Consultation,44a7a62d-0d08-4fef-9df8-669f9bd2bf78,Subcategory for Staging Consultation,True
5f58aba7-d76c-478b-8d64-28e635296cd9,Staging Quote Request,44a7a62d-0d08-4fef-9df8-669f9bd2bf78,Subcategory for Staging Quote Request,True
12aaa2e4-d2cd-4b76-a5eb-466b74cf654d,Furniture Rental,44a7a62d-0d08-4fef-9df8-669f9bd2bf78,Subcategory for Furniture Rental,True
11dd515c-20ce-48d8-898f-20d730781518,Staging Coordination,44a7a62d-0d08-4fef-9df8-669f9bd2bf78,Subcategory for Staging Coordination,True
868f1953-b786-4706-82d7-6986c34374dc,Destaging Request,44a7a62d-0d08-4fef-9df8-669f9bd2bf78,Subcategory for Destaging Request,True
f23e6435-a8bc-4a69-b263-c5078d806a43,Virtual Staging,44a7a62d-0d08-4fef-9df8-669f9bd2bf78,Subcategory for Virtual Staging,True
3785e73d-45d4-4660-8b79-2bd95d63325d,Staging Photos,44a7a62d-0d08-4fef-9df8-669f9bd2bf78,Subcategory for Staging Photos,True
cb8badb9-1e8a-456a-b790-3a445336ae48,Commercial Listing Setup,ff0f4719-04fa-4e43-b464-e204b8c94476,Subcategory for Commercial Listing Setup,True
8083335d-d696-4d8c-8974-d12a2925d2e2,Property Information Package,ff0f4719-04fa-4e43-b464-e204b8c94476,Subcategory for Property Information Package,True
6e382bd6-c8cc-466a-9a96-fe3c5ffae639,Marketing Package,ff0f4719-04fa-4e43-b464-e204b8c94476,Subcategory for Marketing Package,True
00d84db5-df2f-4535-9b7c-97e83bc521d6,LoopNet Listing,ff0f4719-04fa-4e43-b464-e204b8c94476,Subcategory for LoopNet Listing,True
e8751ee5-29d4-42ef-ac5b-b12e94d30cbe,CoStar Listing,ff0f4719-04fa-4e43-b464-e204b8c94476,Subcategory for CoStar Listing,True
0ec2933c-0809-40e5-b394-06a223e53937,Commercial Photos,ff0f4719-04fa-4e43-b464-e204b8c94476,Subcategory for Commercial Photos,True
08ba040c-e89f-447c-9f11-d90c12ba1e8e,Commercial Video,ff0f4719-04fa-4e43-b464-e204b8c94476,Subcategory for Commercial Video,True
ad301097-ba77-470d-914e-5cc1646a5fd0,Aerial/Drone Photography,ff0f4719-04fa-4e43-b464-e204b8c94476,Subcategory for Aerial/Drone Photography,True
22a91768-27fe-48bc-8aae-73ceb7c4af50,Floor Plan Request,ff0f4719-04fa-4e43-b464-e204b8c94476,Subcategory for Floor Plan Request,True
41887f02-eaef-4b8d-abf7-cbc1a3ba8dd7,Site Plan Request,ff0f4719-04fa-4e43-b464-e204b8c94476,Subcategory for Site Plan Request,True
4a914c2c-0596-4fb4-ae10-ddea94cd41f8,Lease Proposal,68bfb059-dce8-4049-856c-683fcd1357b3,Subcategory for Lease Proposal,True
e7298e5b-a47f-4c07-8d02-ab53c76ad252,LOI Preparation,68bfb059-dce8-4049-856c-683fcd1357b3,Subcategory for LOI Preparation,True
629db50d-8e65-417d-ab9a-f9701b81ac2f,Lease Abstract,68bfb059-dce8-4049-856c-683fcd1357b3,Subcategory for Lease Abstract,True
5805dc59-a691-4e31-b349-284f04798f21,Rent Roll Analysis,68bfb059-dce8-4049-856c-683fcd1357b3,Subcategory for Rent Roll Analysis,True
aedc5630-2d2b-4c5e-a6ba-e770b5908ff7,Tenant Improvement,68bfb059-dce8-4049-856c-683fcd1357b3,Subcategory for Tenant Improvement,True
0d1e34c4-590a-4622-9d57-367cc19d7482,Lease Renewal,68bfb059-dce8-4049-856c-683fcd1357b3,Subcategory for Lease Renewal,True
43ed6eb2-a253-44ee-a4e9-b2e96a6c901d,Lease Amendment,68bfb059-dce8-4049-856c-683fcd1357b3,Subcategory for Lease Amendment,True
abd7fab6-5c96-4a21-9c42-b0ccff94c123,Tenant Coordination,68bfb059-dce8-4049-856c-683fcd1357b3,Subcategory for Tenant Coordination,True
fb5c3c7d-e71a-4eaf-968e-c751b04b0126,Move-In Coordination,68bfb059-dce8-4049-856c-683fcd1357b3,Subcategory for Move-In Coordination,True
833d8aaf-59fc-47de-9815-2d87758e425e,Move-Out Coordination,68bfb059-dce8-4049-856c-683fcd1357b3,Subcategory for Move-Out Coordination,True
9fa23bfc-8355-46df-88ad-a6f1874f08bf,Property Condition Report,8e089669-a974-4026-b10c-eb83cf8599ad,Subcategory for Property Condition Report,True
4b74b681-5f07-46d2-98dd-0414643be75f,Environmental Assessment,8e089669-a974-4026-b10c-eb83cf8599ad,Subcategory for Environmental Assessment,True
97de3802-34f4-4484-97e0-9f8d0f234c9a,Survey Request,8e089669-a974-4026-b10c-eb83cf8599ad,Subcategory for Survey Request,True
f1f4b3f6-4d6f-437f-8dfb-c5c9c0cd7a5e,Title Review,8e089669-a974-4026-b10c-eb83cf8599ad,Subcategory for Title Review,True
ed7aec24-3230-4064-9f0b-909799d83b2f,Zoning Analysis,8e089669-a974-4026-b10c-eb83cf8599ad,Subcategory for Zoning Analysis,True
ae0f1609-3d18-4f6d-935b-6099cf9380a1,Financial Underwriting,8e089669-a974-4026-b10c-eb83cf8599ad,Subcategory for Financial Underwriting,True
faef73af-0ca3-43e1-bd4b-880b277eeb01,Rent Comp Analysis,8e089669-a974-4026-b10c-eb83cf8599ad,Subcategory for Rent Comp Analysis,True
0935717b-8092-4239-9bd6-2c3059d38325,Market Study,8e089669-a974-4026-b10c-eb83cf8599ad,Subcategory for Market Study,True
71487578-bdf1-4ebf-a54f-83c8ddb19583,Investment Memo,8e089669-a974-4026-b10c-eb83cf8599ad,Subcategory for Investment Memo,True
2a58ef3d-f3ce-4346-a6bf-381366d0f474,Lead Assignment,bf282860-85d8-4eea-8157-b113af55c286,Subcategory for Lead Assignment,True
5374348c-3736-4f83-9a6a-ad885b598091,Lead Routing Setup,bf282860-85d8-4eea-8157-b113af55c286,Subcategory for Lead Routing Setup,True
ffd42636-32fa-4f92-a064-292ae7fe6ade,Pipeline Report,bf282860-85d8-4eea-8157-b113af55c286,Subcategory for Pipeline Report,True
c527ac4f-dc50-4603-9e2a-be6ba9a0f13d,Sales Forecast,bf282860-85d8-4eea-8157-b113af55c286,Subcategory for Sales Forecast,True
2cf252c9-cc0a-4a32-b57f-e3844271afc8,Commission Calculation,bf282860-85d8-4eea-8157-b113af55c286,Subcategory for Commission Calculation,True
7889ca20-e264-4356-be8c-03b033796e90,Territory Update,bf282860-85d8-4eea-8157-b113af55c286,Subcategory for Territory Update,True
8bdf1591-1c52-4835-9e8e-3d7bd393d457,Sales Tool Access,bf282860-85d8-4eea-8157-b113af55c286,Subcategory for Sales Tool Access,True
d50e6d1e-6f3d-4264-ae79-76dce022df1c,CRM Training Request,bf282860-85d8-4eea-8157-b113af55c286,Subcategory for CRM Training Request,True
7e958558-fa69-40e6-a94c-c99837b88ce7,Sales Collateral,bf282860-85d8-4eea-8157-b113af55c286,Subcategory for Sales Collateral,True
41c78c3e-ed47-4228-92f1-662b9c535e3b,Competitive Analysis,bf282860-85d8-4eea-8157-b113af55c286,Subcategory for Competitive Analysis,True
9f3c6d26-d435-46b0-8ee6-6cb2bf495805,CRM Data Entry,bb657677-ef36-4c93-89a2-01b5c4f454c1,Subcategory for CRM Data Entry,True
13876710-82f6-4857-817e-748827a991f1,Contact Import,bb657677-ef36-4c93-89a2-01b5c4f454c1,Subcategory for Contact Import,True
1cc354fd-2da2-4aab-817b-8a0dd7ac2f67,Contact Merge/Dedupe,bb657677-ef36-4c93-89a2-01b5c4f454c1,Subcategory for Contact Merge/Dedupe,True
81e08d48-af99-443b-9089-d9a046bf523e,Automation Setup,bb657677-ef36-4c93-89a2-01b5c4f454c1,Subcategory for Automation Setup,True
c9b9a179-605f-48ca-b9c4-125b2d162eb0,Workflow Creation,bb657677-ef36-4c93-89a2-01b5c4f454c1,Subcategory for Workflow Creation,True
9ada7a66-cede-4314-991b-ac41621bcbb9,Drip Campaign Setup,bb657677-ef36-4c93-89a2-01b5c4f454c1,Subcategory for Drip Campaign Setup,True
492c250a-5018-4996-b456-93798b8ce77c,Task Automation,bb657677-ef36-4c93-89a2-01b5c4f454c1,Subcategory for Task Automation,True
c6b029c9-9cb0-4dd6-9388-5b2c72edc2da,Notification Setup,bb657677-ef36-4c93-89a2-01b5c4f454c1,Subcategory for Notification Setup,True
fcfb26ea-c6ff-4ed9-959d-501007facfae,Integration Request,bb657677-ef36-4c93-89a2-01b5c4f454c1,Subcategory for Integration Request,True
e42d4933-ca0a-4239-99a1-62be22020712,CRM Bug Report,bb657677-ef36-4c93-89a2-01b5c4f454c1,Subcategory for CRM Bug Report,True
e1a0ecf0-5291-46b6-8c9d-e30fc25dbfd8,Lead Source Setup,39233e10-329c-43da-b2a1-cf660f434afc,Subcategory for Lead Source Setup,True
f2fb11a2-7e94-42ba-9b5a-e5d04a8333cc,Landing Page Request,39233e10-329c-43da-b2a1-cf660f434afc,Subcategory for Landing Page Request,True
8e5a7007-8638-487c-9680-860ee23b7358,Lead Magnet Creation,39233e10-329c-43da-b2a1-cf660f434afc,Subcategory for Lead Magnet Creation,True
8c2d1042-ebfc-4f38-a643-fe6e05a130bc,Webinar Setup,39233e10-329c-43da-b2a1-cf660f434afc,Subcategory for Webinar Setup,True
c933cea2-6e5a-4884-b52e-0911c07c59f8,Lead Scoring Setup,39233e10-329c-43da-b2a1-cf660f434afc,Subcategory for Lead Scoring Setup,True
20bda116-45ad-4a83-a57f-1778c78c91bd,Lead Qualification,39233e10-329c-43da-b2a1-cf660f434afc,Subcategory for Lead Qualification,True
0bc379f6-3d6a-4b94-b007-c69a7bd4df53,Lead Nurture Campaign,39233e10-329c-43da-b2a1-cf660f434afc,Subcategory for Lead Nurture Campaign,True
8ca5538d-048b-4dec-8aab-bf4f46e10a83,Referral Program,39233e10-329c-43da-b2a1-cf660f434afc,Subcategory for Referral Program,True
d2073768-97ba-443e-b954-1cdaa3a592f1,General Inquiry,5c5e6212-7293-4f5c-a09b-72acb27ef950,Subcategory for General Inquiry,True
8c3bad10-7e19-461c-b3c6-feb55c0f5c2b,Service Complaint,5c5e6212-7293-4f5c-a09b-72acb27ef950,Subcategory for Service Complaint,True
1fb31c42-d4aa-4c53-a48b-1298e2e8907a,Billing Question,5c5e6212-7293-4f5c-a09b-72acb27ef950,Subcategory for Billing Question,True
495fe48b-f101-4fc5-837f-cab4ba645f51,Account Access Issue,5c5e6212-7293-4f5c-a09b-72acb27ef950,Subcategory for Account Access Issue,True
13d1054a-44bd-4c47-8cdc-88c0c6d068df,Product Question,5c5e6212-7293-4f5c-a09b-72acb27ef950,Subcategory for Product Question,True
4d37a75a-a871-4163-881b-f794dc3e6a75,Feature Request,5c5e6212-7293-4f5c-a09b-72acb27ef950,Subcategory for Feature Request,True
99da10db-ca45-4768-ba66-997a8a2a7fc3,Bug Report,5c5e6212-7293-4f5c-a09b-72acb27ef950,Subcategory for Bug Report,True
94817811-4ac2-4ec2-a8ab-fda38eb19540,Escalation Request,5c5e6212-7293-4f5c-a09b-72acb27ef950,Subcategory for Escalation Request,True
cc1e40c4-0d97-4211-bc5c-770e415fba40,Feedback Submission,5c5e6212-7293-4f5c-a09b-72acb27ef950,Subcategory for Feedback Submission,True
b399cb27-6ca2-49d9-9038-efe8275b5b53,Survey Response,5c5e6212-7293-4f5c-a09b-72acb27ef950,Subcategory for Survey Response,True
